[
  {
    "id": "story-v2-party",
    "title_left": "PARTY",
    "title_right": "PARTY WITH YOU",
    "format": "x-with-you",
    "category": "Weekends",
    "left_character": "boy",
    "left_character_action": "stands alone near the snack table holding one red plastic cup",
    "left_setting": "a small minimalist indoor party room",
    "left_props": ["red plastic cup", "two deflated balloons", "small snack table", "plain bowl of chips", "two pieces of confetti"],
    "left_emotion": "Nervous, awkward, and unsure where to stand—never happy.",
    "right_characters": "boy_and_girl",
    "right_character_actions": "stand close together, each holding one red plastic cup, laughing and dancing while looking at each other",
    "right_setting": "the same small minimalist indoor party room",
    "right_props": ["two red plastic cups", "floating balloons", "same snack table", "small assortment of warm-neutral snacks", "a few pieces of confetti"],
    "right_emotion": "Lively, playful, and warm because they are together.",
    "shared_environment": "Same small indoor party room with one snack table, balloons, the same floor, and the same camera view.",
    "environmental_contrast": "Left has deflated balloons, sparse snacks, and stillness. Right has floating balloons, fuller snacks, confetti, and movement.",
    "background_color": "pastel peach",
    "accent_color": "muted red",
    "camera_angle": "medium-wide straight-on",
    "prop_count": 5,
    "brand_friendly": true,
    "brand_categories": ["drinks", "snacks"],
    "execution_risks": ["No crowds or extra characters", "Keep cups correctly scaled and do not create fingers", "Keep the snack table secondary and both characters on the floor"],
    "notes": "Canonical scene-depth example: designed, readable, and lively without becoming crowded.",
    "status": "Approved",
    "migration_version": 2
  },
  {
    "id": "story-v2-movies",
    "title_left": "MOVIES",
    "title_right": "MOVIES WITH YOU",
    "format": "x-with-you",
    "category": "Rest",
    "left_character": "boy",
    "left_character_action": "lies alone across one couch seat holding a remote",
    "left_setting": "a simple living room facing a small television",
    "left_props": ["rounded couch", "remote", "small popcorn bowl", "small television"],
    "left_emotion": "Bored and disengaged, never happy.",
    "right_characters": "boy_and_girl",
    "right_character_actions": "cuddle together on the same couch while watching the same movie",
    "right_setting": "the same simple living room facing the same small television",
    "right_props": ["same rounded couch", "shared blanket", "popcorn bowl", "two small snack bowls", "same television"],
    "right_emotion": "Loving and excited by the shared comfort.",
    "shared_environment": "Same living room, couch, television position, floor, and camera angle.",
    "environmental_contrast": "Left is still and sparse with one bowl. Right adds one shared blanket and a few snacks while keeping the room unchanged.",
    "background_color": "dusty blue",
    "accent_color": "muted coral",
    "camera_angle": "medium back three-quarter view",
    "prop_count": 5,
    "brand_friendly": true,
    "brand_categories": ["snacks", "blankets"],
    "execution_risks": ["Bodies must sit directly on the couch seat", "Do not obscure the bow, ponytail, or two hair tufts", "Keep snack bowls smaller than either face"],
    "notes": "Comfort comes from proximity, not from a more luxurious room.",
    "status": "Approved",
    "migration_version": 2
  },
  {
    "id": "story-v2-saturdays",
    "title_left": "SATURDAYS",
    "title_right": "SATURDAYS WITH YOU",
    "format": "x-with-you",
    "category": "Weekends",
    "left_character": "boy",
    "left_character_action": "sleeps late in a rumpled bed near noon",
    "left_setting": "a minimal bedroom at the start of a slow Saturday",
    "left_props": ["rumpled bed", "small clock", "one pillow on the floor", "phone on nightstand"],
    "left_emotion": "Sleepy and unmotivated, never cheerful.",
    "right_characters": "boy_and_girl",
    "right_character_actions": "walk side by side through a small farmers market, sharing the morning outing",
    "right_setting": "a minimalist farmers market later in the same Saturday",
    "right_props": ["two coffee cups", "small flower bundle", "one produce stand", "one striped canopy"],
    "right_emotion": "Curious, energized, and warmly connected.",
    "shared_environment": "One continuous pastel background, consistent character scale, rounded prop language, and matching weekend-day simplicity connect the two Saturday snapshots.",
    "environmental_contrast": "Left is an inactive late bedroom. Right is a calm market outing with gentle movement and shared discovery.",
    "background_color": "warm sand",
    "accent_color": "muted teal",
    "camera_angle": "medium-wide straight-on",
    "prop_count": 4,
    "brand_friendly": true,
    "brand_categories": ["coffee", "flowers", "groceries"],
    "execution_risks": ["Treat this as a deliberate before-and-after weekend contrast", "Keep the market to one stand with no crowd", "Characters remain on the floor with no visible legs"],
    "notes": "A controlled format exception: the setting changes to show a Saturday becoming active together.",
    "status": "Approved",
    "migration_version": 2
  },
  {
    "id": "story-v2-sundays",
    "title_left": "SUNDAYS",
    "title_right": "SUNDAYS WITH YOU",
    "format": "x-with-you",
    "category": "Home",
    "left_character": "boy",
    "left_character_action": "folds one towel alone beside the laundry basket",
    "left_setting": "a simple laundry corner at home",
    "left_props": ["laundry basket", "one towel", "one unmatched sock"],
    "left_emotion": "Quietly bored and low-energy.",
    "right_characters": "boy_and_girl",
    "right_character_actions": "fold laundry together while one sock arcs playfully through the air",
    "right_setting": "the same simple laundry corner at home",
    "right_props": ["same laundry basket", "playful tossed sock", "small folded stack", "one towel"],
    "right_emotion": "Laughing and playful while completing the same chore.",
    "shared_environment": "Same home laundry corner, basket position, floor, and camera view.",
    "environmental_contrast": "Left has an unmatched sock and stillness. Right has a small completed stack and one playful moving sock.",
    "background_color": "soft lavender",
    "accent_color": "muted plum",
    "camera_angle": "medium-wide straight-on",
    "prop_count": 4,
    "brand_friendly": true,
    "brand_categories": ["home goods", "laundry"],
    "execution_risks": ["Keep baskets on the floor", "Use only one airborne sock", "Do not create long arms while folding"],
    "notes": "The task stays ordinary; playfulness supplies the contrast.",
    "status": "Approved",
    "migration_version": 2
  },
  {
    "id": "story-v2-errands",
    "title_left": "ERRANDS",
    "title_right": "ERRANDS WITH YOU",
    "format": "x-with-you",
    "category": "Errands",
    "left_character": "boy",
    "left_character_action": "carries grocery bags alone across the store exit area",
    "left_setting": "a minimal grocery-store exit with one cart return line",
    "left_props": ["two grocery bags", "visible bread", "visible produce"],
    "left_emotion": "Bored and weighed down by the task.",
    "right_characters": "boy_and_girl",
    "right_character_actions": "stand on the floor and push the same shopping cart together",
    "right_setting": "the same minimal grocery-store exit",
    "right_props": ["shopping cart", "favorite snacks", "flowers", "bread"],
    "right_emotion": "Laughing and pleased to finish together.",
    "shared_environment": "Same grocery exit, floor line, cart scale, and camera view.",
    "environmental_contrast": "Left has separated bags and effort. Right organizes the same purchase into one shared cart with one affectionate flower detail.",
    "background_color": "blush pink",
    "accent_color": "muted green",
    "camera_angle": "medium profile view",
    "prop_count": 4,
    "brand_friendly": true,
    "brand_categories": ["groceries", "snacks", "flowers"],
    "execution_risks": ["Both characters stay on the floor beside the cart", "Only groceries go inside the cart", "Keep bags and cart below character-face height"],
    "notes": "The cart replaces loose effort with shared teamwork.",
    "status": "Approved",
    "migration_version": 2
  },
  {
    "id": "story-v2-walks",
    "title_left": "WALKS",
    "title_right": "WALKS WITH YOU",
    "format": "x-with-you",
    "category": "Everyday routines",
    "left_character": "boy",
    "left_character_action": "walks alone with his nub arms tucked behind his round body",
    "left_setting": "a quiet minimalist park path",
    "left_props": ["curved park path", "one fallen leaf"],
    "left_emotion": "Quiet and reflective, never happy.",
    "right_characters": "boy_and_girl",
    "right_character_actions": "walk close together and hold nub arms while looking at each other",
    "right_setting": "the same quiet minimalist park path",
    "right_props": ["same curved path", "two coffee cups", "small flowers", "one butterfly"],
    "right_emotion": "Warm, affectionate, and present.",
    "shared_environment": "Same park path, horizon, ground line, and side-view camera.",
    "environmental_contrast": "Left uses one fallen leaf and open space. Right adds shared coffee, flowers, and one butterfly without changing the path.",
    "background_color": "warm sage",
    "accent_color": "soft coral",
    "camera_angle": "medium profile view",
    "prop_count": 4,
    "brand_friendly": true,
    "brand_categories": ["coffee", "flowers"],
    "execution_risks": ["Imply walking without visible legs", "Use nub-to-nub contact without fingers", "Keep the butterfly small and secondary"],
    "notes": "One path, one pace, and a clear shift from solitude to connection.",